{
  "schema_version": "1.0",
  "categories": [
    {
      "id": "database",
      "label": "データベース"
    },
    {
      "id": "auth",
      "label": "認証(ログイン)"
    },
    {
      "id": "ui-ux",
      "label": "UI-UX"
    },
    {
      "id": "security",
      "label": "セキュリティ"
    },
    {
      "id": "infrastructure",
      "label": "インフラ"
    },
    {
      "id": "backend",
      "label": "バックエンド"
    },
    {
      "id": "frontend",
      "label": "フロントエンド"
    },
    {
      "id": "maintenance-ops",
      "label": "保守運用管理"
    }
  ],
  "platforms": [
    "web",
    "mobile",
    "tablet",
    "desktop-windows",
    "desktop-linux",
    "desktop-macos"
  ],
  "matrix": {
    "database": {
      "web": {
        "state": "確定",
        "qa_ref": "qa-001",
        "serves_goals": [
          "G1"
        ]
      },
      "mobile": {
        "state": "対象外",
        "approval_ref": "appr-001"
      },
      "tablet": {
        "state": "対象外",
        "approval_ref": "appr-001"
      },
      "desktop-windows": {
        "state": "対象外",
        "approval_ref": "appr-001"
      },
      "desktop-linux": {
        "state": "対象外",
        "approval_ref": "appr-001"
      },
      "desktop-macos": {
        "state": "対象外",
        "approval_ref": "appr-001"
      }
    },
    "auth": {
      "web": {
        "state": "確定",
        "qa_ref": "qa-002",
        "serves_goals": [
          "G1"
        ]
      },
      "mobile": {
        "state": "対象外",
        "approval_ref": "appr-001"
      },
      "tablet": {
        "state": "対象外",
        "approval_ref": "appr-001"
      },
      "desktop-windows": {
        "state": "対象外",
        "approval_ref": "appr-001"
      },
      "desktop-linux": {
        "state": "対象外",
        "approval_ref": "appr-001"
      },
      "desktop-macos": {
        "state": "対象外",
        "approval_ref": "appr-001"
      }
    },
    "ui-ux": {
      "web": {
        "state": "確定",
        "qa_ref": "qa-003",
        "serves_goals": [
          "G1"
        ]
      },
      "mobile": {
        "state": "対象外",
        "approval_ref": "appr-001"
      },
      "tablet": {
        "state": "対象外",
        "approval_ref": "appr-001"
      },
      "desktop-windows": {
        "state": "対象外",
        "approval_ref": "appr-001"
      },
      "desktop-linux": {
        "state": "対象外",
        "approval_ref": "appr-001"
      },
      "desktop-macos": {
        "state": "対象外",
        "approval_ref": "appr-001"
      }
    },
    "security": {
      "web": {
        "state": "確定",
        "qa_ref": "qa-004",
        "serves_goals": [
          "G1"
        ]
      },
      "mobile": {
        "state": "対象外",
        "approval_ref": "appr-001"
      },
      "tablet": {
        "state": "対象外",
        "approval_ref": "appr-001"
      },
      "desktop-windows": {
        "state": "対象外",
        "approval_ref": "appr-001"
      },
      "desktop-linux": {
        "state": "対象外",
        "approval_ref": "appr-001"
      },
      "desktop-macos": {
        "state": "対象外",
        "approval_ref": "appr-001"
      }
    },
    "infrastructure": {
      "web": {
        "state": "確定",
        "qa_ref": "qa-005",
        "serves_goals": [
          "G1"
        ]
      },
      "mobile": {
        "state": "対象外",
        "approval_ref": "appr-001"
      },
      "tablet": {
        "state": "対象外",
        "approval_ref": "appr-001"
      },
      "desktop-windows": {
        "state": "対象外",
        "approval_ref": "appr-001"
      },
      "desktop-linux": {
        "state": "対象外",
        "approval_ref": "appr-001"
      },
      "desktop-macos": {
        "state": "対象外",
        "approval_ref": "appr-001"
      }
    },
    "backend": {
      "web": {
        "state": "確定",
        "qa_ref": "qa-006",
        "serves_goals": [
          "G1"
        ]
      },
      "mobile": {
        "state": "対象外",
        "approval_ref": "appr-001"
      },
      "tablet": {
        "state": "対象外",
        "approval_ref": "appr-001"
      },
      "desktop-windows": {
        "state": "対象外",
        "approval_ref": "appr-001"
      },
      "desktop-linux": {
        "state": "対象外",
        "approval_ref": "appr-001"
      },
      "desktop-macos": {
        "state": "対象外",
        "approval_ref": "appr-001"
      }
    },
    "frontend": {
      "web": {
        "state": "確定",
        "qa_ref": "qa-007",
        "serves_goals": [
          "G1"
        ]
      },
      "mobile": {
        "state": "対象外",
        "approval_ref": "appr-001"
      },
      "tablet": {
        "state": "対象外",
        "approval_ref": "appr-001"
      },
      "desktop-windows": {
        "state": "対象外",
        "approval_ref": "appr-001"
      },
      "desktop-linux": {
        "state": "対象外",
        "approval_ref": "appr-001"
      },
      "desktop-macos": {
        "state": "対象外",
        "approval_ref": "appr-001"
      }
    },
    "maintenance-ops": {
      "web": {
        "state": "確定",
        "qa_ref": "qa-008",
        "serves_goals": [
          "G1"
        ]
      },
      "mobile": {
        "state": "対象外",
        "approval_ref": "appr-001"
      },
      "tablet": {
        "state": "対象外",
        "approval_ref": "appr-001"
      },
      "desktop-windows": {
        "state": "対象外",
        "approval_ref": "appr-001"
      },
      "desktop-linux": {
        "state": "対象外",
        "approval_ref": "appr-001"
      },
      "desktop-macos": {
        "state": "対象外",
        "approval_ref": "appr-001"
      }
    }
  },
  "qa_log": [
    {
      "id": "qa-001",
      "question": "データベース（database）× Web の要件は?",
      "answer": "PostgreSQL 15。ユーザー/請求/監査ログの3スキーマ。日次バックアップ。"
    },
    {
      "id": "qa-002",
      "question": "認証(ログイン)（auth）× Web の要件は?",
      "answer": "OIDC(社内 IdP)+ ロールベース認可。セッションは 8h。"
    },
    {
      "id": "qa-003",
      "question": "UI-UX（ui-ux）× Web の要件は?",
      "answer": "レスポンシブ Web。WCAG 2.1 AA 目標。主要動線は3クリック以内。"
    },
    {
      "id": "qa-004",
      "question": "セキュリティ（security）× Web の要件は?",
      "answer": "TLS1.3・入力検証・監査ログ・OWASP Top10 受動対策。"
    },
    {
      "id": "qa-005",
      "question": "インフラ（infrastructure）× Web の要件は?",
      "answer": "コンテナを社内 k8s にデプロイ。CI/CD は GitHub Actions。"
    },
    {
      "id": "qa-006",
      "question": "バックエンド（backend）× Web の要件は?",
      "answer": "Python/FastAPI。REST + 非同期ジョブ(キュー)。"
    },
    {
      "id": "qa-007",
      "question": "フロントエンド（frontend）× Web の要件は?",
      "answer": "React + TypeScript。状態管理は最小限のグローバルストア。"
    },
    {
      "id": "qa-008",
      "question": "保守運用管理（maintenance-ops）× Web の要件は?",
      "answer": "オンコール輪番・障害 runbook・週次リストア訓練。"
    },
    {
      "id": "qa-foundation-u1",
      "question": "利用者との対話で U1 は何か",
      "answer": "請求と監査を単一 Web システムへ統合し二重管理をなくす",
      "source": {"kind": "user-dialogue"}
    },
    {
      "id": "qa-foundation-u2",
      "question": "利用者との対話で U2 は何か",
      "answer": "表計算と個別ツールが乱立し請求漏れと監査コストが慢性化している",
      "source": {"kind": "user-dialogue"}
    },
    {
      "id": "qa-foundation-u3",
      "question": "利用者との対話で U3 は何か",
      "answer": "請求・監査データを単一の信頼できる情報源へ統合する",
      "source": {"kind": "user-dialogue"}
    },
    {
      "id": "qa-foundation-u4",
      "question": "利用者との対話で U4 は何か",
      "answer": "請求漏れ検知を自動化する",
      "source": {"kind": "user-dialogue"}
    },
    {
      "id": "qa-foundation-u5",
      "question": "利用者との対話で U5 は何か",
      "answer": "請求漏れ0件が3ヶ月継続する",
      "source": {"kind": "user-dialogue"}
    },
    {
      "id": "qa-foundation-u6",
      "question": "利用者との対話で U6 は何か",
      "answer": "経理チーム",
      "source": {"kind": "user-dialogue"}
    },
    {
      "id": "qa-foundation-u7",
      "question": "利用者との対話で U7 は何か",
      "answer": "請求管理を対象とし給与計算を対象外とする",
      "source": {"kind": "user-dialogue"}
    },
    {
      "id": "qa-foundation-u8",
      "question": "利用者との対話で U8 は何か",
      "answer": "社内 k8s 上で稼働する",
      "source": {"kind": "user-dialogue"}
    },
    {
      "id": "qa-foundation-u9",
      "question": "利用者との対話で U9 は何か",
      "answer": "日次バックアップを行う",
      "source": {"kind": "user-dialogue"}
    }
  ],
  "approval_log": [
    {
      "id": "appr-001",
      "note": "ユーザー一括承認: 非 Web プラットフォームは全カテゴリで対象外"
    },
    {
      "id": "appr-foundation",
      "note": "上位概念 U1-U9 をユーザーと確認し合意した"
    }
  ],
  "reopen_log": [],
  "category_aggregate": {
    "database": "確定",
    "auth": "確定",
    "ui-ux": "確定",
    "security": "確定",
    "infrastructure": "確定",
    "backend": "確定",
    "frontend": "確定",
    "maintenance-ops": "確定"
  },
  "targets": [],
  "requirements_foundation": {
    "essential_purpose": "請求と監査を単一 Web システムへ統合し二重管理をなくす",
    "background": "表計算と個別ツールが乱立し請求漏れと監査コストが慢性化している",
    "goals": [
      {
        "id": "G1",
        "text": "請求・監査データを単一の信頼できる情報源へ統合する"
      },
      {
        "id": "G2",
        "text": "主要業務動線を Web だけで完結できるようにする"
      }
    ],
    "objectives": [
      {
        "id": "O1",
        "text": "請求漏れ検知を自動化",
        "measure": "月次0件"
      }
    ],
    "success_criteria": [
      "請求漏れ0件が3ヶ月継続"
    ],
    "stakeholders": [
      "経理チーム"
    ],
    "scope": {
      "in": [
        "請求管理"
      ],
      "out": [
        "給与計算"
      ]
    },
    "constraints": [
      "社内 k8s 上で稼働"
    ],
    "concrete_intents": [
      {
        "id": "I1",
        "text": "日次バックアップ",
        "serves": [
          "G1"
        ]
      }
    ],
    "confirmed": true,
    "approval_ref": "appr-foundation"
  },
  "decisions": [],
  "knowledge_candidates": [],
  "hearing_progress": {
    "loop_count": 4,
    "next_question": null,
    "complete": true,
    "max_loops": 5
  }
}
